{
  "metadata": {
    "model": "openai/gpt-5.4",
    "harness": "codex",
    "target": "notional-finance",
    "timestamp": "2026-03-24T15:58:42Z",
    "duration_seconds": 4177,
    "skill_version": "v2"
  },
  "summary": {
    "total_findings": 0,
    "critical": 0,
    "high": 0,
    "medium": 0,
    "low": 0,
    "informational": 0
  },
  "findings": [],
  "raw_output": "ERROR: Benchmark run failed. Check /home/vscode/projects/security-audit-skills-benchmark/reports/notional-finance/run-2/codex-ai-gpt-5.4.log for details."
}
