{
  "metadata": {
    "model": "openai/gpt-5.4",
    "harness": "codex",
    "target": "notional-finance",
    "timestamp": "2026-03-24T14:47:06Z",
    "duration_seconds": 3001,
    "skill_version": "v2"
  },
  "summary": {
    "total_findings": 1,
    "critical": 0,
    "high": 1,
    "medium": 0,
    "low": 0,
    "informational": 0
  },
  "findings": [
    {
      "id": "F-001",
      "title": "Partial LP withdraw request sets can brick redemption and oracle valuation",
      "severity": "high",
      "confidence": "high",
      "category": "denial of service",
      "description": "`BaseLPLib.initiateWithdraw` skips any pool leg whose proportional exit amount rounds down to zero, so an account can enter a pending-withdraw state where only a subset of `TOKENS()` has a withdraw request. Later code assumes every leg exists: `getWithdrawRequestValue` hard-reverts on `require(hasRequest)`, and `finalizeAndRedeemWithdrawRequest` unconditionally computes `yieldTokensBurned = uint256(w.yieldTokenAmount) * sharesToRedeem / w.sharesAmount`. For a skipped leg the request struct is zeroed, causing valuation reverts and a division-by-zero during redemption. This is reachable through normal `initiateWithdraw` or `forceWithdraw` flows whenever proportional LP exit rounding produces `exitBalances[i] == 0` for one token. The impact is material: escrowed LP withdrawals can become permanently stuck, and because pending-withdraw valuation reverts, Morpho health checks and liquidation flows for affected positions can also fail.",
      "location": {
        "file": "src/single-sided-lp/AbstractSingleSidedLP.sol",
        "lines": "326-332, 362-373, 387-397"
      },
      "recommendation": "Keep per-leg withdraw state consistent. Either create an explicit request entry for every token during initiation, even when the amount is zero, or update `getWithdrawRequestValue` and `finalizeAndRedeemWithdrawRequest` to skip legs whose manager/request is absent (`requestId == 0` or `sharesAmount == 0`) and treat them as zero-value legs.",
      "agents_reporting": [
        "gpt-5.4"
      ]
    }
  ],
  "raw_output": "# Security Review \u2014 Notional Finance Leveraged Vault Strategies\n\n## Scope\n- Repository: `targets/notional-finance/repo`\n- Commit: `0096f1f64071cafbf20062a7c092c6ec89c28275`\n- Files reviewed: all Solidity files under `src/`, excluding `tests/`, `interfaces/`, `lib/`, and `mocks/`\n- Integrations context reviewed: Morpho Blue, Curve Core, Pendle V2\n- Severity threshold: Critical / High / Medium\n\n## Findings\n\n### [high] Partial LP withdraw request sets can brick redemption and oracle valuation\n- Contracts: `BaseLPLib`, `AbstractSingleSidedLP`\n- Location: `src/single-sided-lp/AbstractSingleSidedLP.sol:326-332, 362-373, 387-397`\n- Agents: `Faraday`, `Helmholtz`, `Ramanujan`, `Ohm`\n\n**Description**\n`BaseLPLib.initiateWithdraw` skips any pool leg whose proportional exit amount rounds down to zero. Later pending-withdrawal code assumes every token in `TOKENS()` has a matching withdraw request: `getWithdrawRequestValue` hard-reverts on `require(hasRequest)`, and `finalizeAndRedeemWithdrawRequest` unconditionally computes `yieldTokensBurned = w.yieldTokenAmount * sharesToRedeem / w.sharesAmount`. If one leg was skipped, that leg's request struct remains zeroed and redemption divides by zero while valuation reverts.\n\nThis state is reachable through normal usage. A borrower or liquidator can initiate a proportional LP withdraw on a sufficiently imbalanced or dust-sized position so that one exit balance becomes zero after integer rounding. Once that happens, the account still has at least one pending request, so the vault switches to the pending-withdraw valuation path and becomes non-redeemable. Because pricing during pending withdraws can now revert, Morpho health checks and liquidation flows that depend on vault pricing can also fail.\n\n**Gate evaluation**\n- Refutation: no guard restores the missing per-token request or skips zero-request legs later.\n- Reachability: achievable through ordinary `initiateWithdraw` / `forceWithdraw` flows whenever a proportional pool exit returns `0` for one leg.\n- Trigger: any user withdrawing their own position, or a third party using `forceWithdraw` on an unhealthy position.\n- Impact: escrowed shares can become stuck, pending withdraws can no longer be redeemed, and affected LP-backed positions may become unliquidatable.\n\n**Recommendation**\nMake withdraw-request handling consistent across all pool legs. Either create an explicit zero-amount request entry for every token during initiation, or update `getWithdrawRequestValue` and `finalizeAndRedeemWithdrawRequest` to skip tokens whose manager/request is absent (`requestId == 0` or `sharesAmount == 0`) and treat them as zero-value legs.\n\n## Excluded After Validation\n- The Curve V2 liquidation probe issue was not included because the in-scope code and tests did not establish an active reachable V2-configured leveraged-vault deployment.\n- The AddressRegistry initialization issue was not included because exploitation depends on an incorrect proxy deployment flow rather than a reachable runtime path in this target."
}